{
  "id": "eo-frontier-ai-security-2026",
  "title": "Executive Order, Promoting Advanced Artificial Intelligence Innovation and Security (voluntary pre-release review of covered frontier models)",
  "date": "2026-06-02",
  "type": "coalition",
  "arena": "federal",
  "people": [
    "donald-trump"
  ],
  "source": "https://www.skadden.com/insights/publications/2026/06/new-ai-executive-order"
}
