{
  "id": "ag-letter-moratorium-may-2025",
  "title": "Bipartisan letter of 40 attorneys general to Congress opposing the 10-year state AI enforcement moratorium in budget reconciliation",
  "date": "2025-05-16",
  "type": "letter",
  "arena": "federal",
  "people": [
    "charity-clark",
    "phil-weiser",
    "jonathan-skrmetti",
    "john-formella"
  ],
  "source": "https://ago.vermont.gov/blog/2025/05/16/attorney-general-clark-leads-bipartisan-letter-congress-opposing-budget-amendment-prohibiting-states"
}
