{
  "id": "rogue-ai-hearing-2026",
  "title": "HSGAC Disaster Management subcommittee hearing on rogue AI and AI agents (scheduled Sept 30, 2026)",
  "date": "2026-09-30",
  "type": "hearing",
  "arena": "federal",
  "people": [
    "josh-hawley"
  ],
  "source": "https://legis1.com/news/rogue-ai-threat-senate-panel-will-examine"
}
