{
  "id": "fl-sb482-ai-bill-of-rights",
  "title": "Florida SB 482 — Artificial Intelligence Bill of Rights (2026)",
  "date": "2026-03-04",
  "type": "bill",
  "arena": "state",
  "people": [
    "ron-desantis",
    "tom-leek",
    "daniel-perez"
  ],
  "source": "https://www.cfpublic.org/politics/2026-03-05/senate-approves-house-obstructed-ai-bill-of-rights"
}
