{
  "id": "ai-action-plan-2025",
  "title": "America's AI Action Plan (Winning the Race)",
  "date": "2025-07-23",
  "type": "coalition",
  "arena": "federal",
  "people": [
    "donald-trump",
    "david-sacks",
    "michael-kratsios"
  ],
  "source": "https://www.whitehouse.gov/wp-content/uploads/2025/07/Americas-AI-Action-Plan.pdf"
}
