{
  "id": "nm-ai-accountability-act-2026",
  "title": "New Mexico Artificial Intelligence Accountability Act (HB 141)",
  "date": "2026-01",
  "type": "bill",
  "arena": "state",
  "people": [
    "raul-torrez",
    "linda-serrato"
  ],
  "source": "https://www.dailylobo.com/article/2026/01/nm-ag-announces-legislation-to-protect-victims-of-ai-deepfakes"
}
