{
  "id": "ai-risk-evaluation-act",
  "title": "Artificial Intelligence Risk Evaluation Act of 2025 (S. 2938)",
  "date": "2025-09-29",
  "type": "bill",
  "arena": "federal",
  "people": [
    "josh-hawley",
    "richard-blumenthal"
  ],
  "source": "https://www.govtrack.us/congress/bills/119/s2938/text"
}
