{
  "id": "ndaa-preemption-2025",
  "title": "Attempt to add state AI law preemption to the FY26 NDAA (dropped)",
  "date": "2025-12-04",
  "type": "bill",
  "arena": "federal",
  "people": [
    "steve-scalise",
    "ted-cruz"
  ],
  "source": "https://broadbandbreakfast.com/scalise-no-ai-moratorium-in-national-defense-authorization-act/"
}
