{
  "id": "reconciliation-ai-moratorium-2025",
  "title": "10-year moratorium on state AI law enforcement in the 2025 budget reconciliation bill (House E&C text; Senate version tied to BEAD funding)",
  "date": "2025-05-14",
  "type": "bill",
  "arena": "federal",
  "people": [
    "brett-guthrie",
    "ted-cruz"
  ],
  "source": "https://iapp.org/news/a/proposed-federal-moratorium-on-us-state-level-ai-regulation-passes-house-committee"
}
