{
  "id": "la-ai-bills-shelved-2026",
  "title": "Louisiana legislators shelve seven AI bills after Trump's broadband-funding threat",
  "date": "2026-04-01",
  "type": "coalition",
  "arena": "state",
  "people": [
    "jay-luneau",
    "vincent-cox",
    "jeff-landry"
  ],
  "source": "https://www.wwno.org/coastal-desk/2026-04-01/louisiana-scraps-some-but-not-all-ai-proposals-after-trump-threats"
}
