{
  "id": "ai-safety-disclosure-letters-2025",
  "title": "Senators' letters to eight AI companies asking for timely, consistent safety disclosures",
  "date": "2025-12-16",
  "type": "letter",
  "arena": "federal",
  "people": [
    "katie-britt",
    "brian-schatz",
    "james-lankford",
    "chris-coons"
  ],
  "source": "https://www.britt.senate.gov/news/press-releases/u-s-senators-katie-britt-brian-schatz-colleagues-press-ai-companies-to-improve-transparency-commit-to-timely-consistent-safety-disclosures/"
}
