{
  "id": "ag-openai-preservation-letter-2026-08",
  "title": "15 Republican AGs' letter to OpenAI demanding preservation of Hugging Face intrusion records and a halt to risky exploitation testing (led by Iowa)",
  "date": "2026-08-03",
  "type": "letter",
  "arena": "state",
  "people": [
    "raul-labrador",
    "austin-knudsen",
    "gentner-drummond",
    "ken-paxton",
    "derek-brown",
    "brenna-bird",
    "todd-rokita",
    "kris-kobach",
    "catherine-hanaway",
    "mike-hilgers"
  ],
  "source": "https://www.iowaattorneygeneral.gov/media/cms/08_5392C9E17791C.pdf"
}
