{
  "id": "naag-delusional-outputs-letter-dec-2025",
  "title": "NAAG letter of 42 attorneys general to 13 AI companies on sycophantic and delusional outputs",
  "date": "2025-12-10",
  "type": "letter",
  "arena": "federal",
  "people": [
    "matthew-platkin",
    "andrea-campbell",
    "dave-sunday",
    "jb-mccuskey"
  ],
  "source": "https://www.njoag.gov/ag-platkin-leads-bipartisan-coalition-demanding-that-tech-companies-put-a-stop-to-harmful-ai-chatbots/"
}
