{
  "id": "moratorium-strike-amendment-2025",
  "title": "Blackburn-Cantwell-Collins-Markey amendment striking the AI moratorium from reconciliation (passed 99-1; only Tillis voted no)",
  "date": "2025-07-01",
  "type": "bill",
  "arena": "federal",
  "people": [
    "marsha-blackburn",
    "maria-cantwell",
    "ed-markey"
  ],
  "source": "https://www.nextgov.com/artificial-intelligence/2025/07/senate-overwhelmingly-passes-amendment-removing-state-ai-moratorium/406448/"
}
