{
  "id": "oh-hb524",
  "title": "Ohio HB 524 — chatbot self-harm penalties",
  "date": "2026-02-18",
  "type": "bill",
  "arena": "state",
  "people": [
    "christine-cockley",
    "ty-mathews"
  ],
  "source": "https://abc6onyourside.com/news/local/ohio-bill-would-fine-ai-companies-if-chatbots-are-found-to-promote-dangerous-behavior"
}
