{
  "id": "eo-14365-state-ai-laws",
  "title": "Executive Order 14365, Ensuring a National Policy Framework for Artificial Intelligence",
  "date": "2025-12-11",
  "type": "coalition",
  "arena": "federal",
  "people": [
    "donald-trump",
    "david-sacks",
    "michael-kratsios",
    "howard-lutnick",
    "pam-bondi",
    "arielle-roth"
  ],
  "source": "https://www.whitehouse.gov/presidential-actions/2025/12/eliminating-state-law-obstruction-of-national-artificial-intelligence-policy/"
}
