{
  "id": "ia-sf2417",
  "title": "Iowa SF 2417 — conversational AI services",
  "date": "2026-05",
  "type": "bill",
  "arena": "state",
  "people": [
    "kim-reynolds",
    "austin-harris"
  ],
  "source": "https://www.govtech.com/artificial-intelligence/iowa-bill-restricting-ai-chatbots-heads-to-governors-desk"
}
