{
  "id": "ny-raise-act",
  "title": "New York RAISE Act (S6953B/A6453B; chapter amendment S8828)",
  "date": "2025-12-19",
  "type": "bill",
  "arena": "state",
  "people": [
    "andrew-gounardes",
    "alex-bores",
    "kathy-hochul"
  ],
  "source": "https://www.governor.ny.gov/news/governor-hochul-signs-nation-leading-legislation-require-ai-frameworks-ai-frontier-models"
}
