{
  "id": "wh-national-ai-legislative-framework-2026",
  "title": "White House National Policy Framework for AI (legislative recommendations)",
  "date": "2026-03-20",
  "type": "coalition",
  "arena": "federal",
  "people": [
    "michael-kratsios",
    "david-sacks"
  ],
  "source": "https://rollcall.com/2026/03/20/white-house-ai-framework-calls-for-preemption-of-state-laws/"
}
