{
  "id": "ai-kill-switch-act",
  "title": "AI Kill Switch Act (H.R. 9917)",
  "date": "2026-07-23",
  "type": "bill",
  "arena": "federal",
  "people": [
    "ted-lieu",
    "nathaniel-moran"
  ],
  "source": "https://lieu.house.gov/media-center/press-releases/reps-lieu-and-moran-introduce-bill-require-kill-switch-ai-systems-can"
}
