{
  "id": "gop-governors-ai-moratorium-letter-2025",
  "title": "17 Republican governors' letter asking Congress to drop the 10-year state AI-law moratorium from the reconciliation bill",
  "date": "2025-06-27",
  "type": "letter",
  "arena": "federal",
  "people": [
    "sarah-huckabee-sanders",
    "kay-ivey",
    "brian-kemp",
    "jeff-landry",
    "henry-mcmaster",
    "bill-lee"
  ],
  "source": "https://governor.arkansas.gov/news_post/sanders-leads-republican-governors-to-call-on-congress-to-remove-ai-regulatory-moratorium-from-one-big-beautiful-bill/"
}
