{
  "id": "ai-emergency-button-act",
  "title": "AI Emergency Button Act (Kennedy); unanimous consent blocked by Paul's objection",
  "date": "2026-09-16",
  "type": "bill",
  "arena": "federal",
  "people": [
    "john-kennedy",
    "rand-paul"
  ],
  "source": "https://www.kennedy.senate.gov/2026/09/16/senate-blocks-kennedy-bill-to-require-ai-developers-to-install-an-emergency-kill-switch/"
}
