{
  "id": "ag-fcc-preemption-comment-2025",
  "title": "Comment letter of 23 attorneys general to the FCC opposing preemption of state AI laws",
  "date": "2025-12-17",
  "type": "letter",
  "arena": "federal",
  "people": [
    "phil-weiser"
  ],
  "source": "https://broadbandbreakfast.com/state-attorneys-general-to-fcc-dont-preempt-ai-laws/"
}
