{
  "id": "ai-systems-transparency-act",
  "title": "AI Systems Transparency Act (ASTA)",
  "date": "2026-09-24",
  "type": "bill",
  "arena": "federal",
  "people": [
    "chris-coons",
    "katie-britt",
    "brian-schatz",
    "james-lankford"
  ],
  "source": "https://www.coons.senate.gov/news/press-releases/senators-coons-britt-schatz-and-lankford-introduce-bipartisan-ai-safety-and-transparency-legislation"
}
